tweet,label,topic_0,topic_1,topic_2,topic_3,topic_4,topic_5,topic_6,topic_7,topic_8,topic_9,topic_10,topic_11,topic_12,topic_13,topic_14,topic_15,topic_16,topic_17,topic_18,topic_19,topic_20,Max
Our total number of confirmed cases of COVID-19 is now 1431 which is the number we report to the World Health Organization.,real,0.0007215007215007218,0.0007215007215007218,0.0007215007215007218,0.0007215007215007218,0.0007215007215007218,0.07647907647907651,0.0007215007215007218,0.0007215007215007218,0.0007215007215007218,0.0007215007215007218,0.9098124098124104,0.0007215007215007218,0.0007215007215007218,0.0007215007215007218,0.0007215007215007218,0.0007215007215007218,0.0007215007215007218,0.0007215007215007218,0.0007215007215007218,0.0007215007215007218,0.0007215007215007218,topic_10
COVID-19 update: There are no new cases of COVID-19 to report in New Zealand today. It has been 99 days since the last case of COVID-19 was acquired locally from an unknown source.,real,0.0006706908115358817,0.0006706908115358817,0.0006706908115358817,0.0006706908115358817,0.0006706908115358817,0.0006706908115358817,0.0006706908115358817,0.0006706908115358817,0.0006706908115358817,0.0006706908115358817,0.986586183769282,0.0006706908115358817,0.0006706908115358817,0.0006706908115358817,0.0006706908115358817,0.0006706908115358817,0.0006706908115358817,0.0006706908115358817,0.0006706908115358817,0.0006706908115358817,0.0006706908115358817,topic_10
That brings New Zealand’s total number of active cases to 14 all are in managed isolation or quarantine facilities. There are no cases in the community.  NZ's total number of confirmed cases of COVID-19 is now 1170 which is the number we report to the WHO.,real,0.00036350418029807346,0.00036350418029807346,0.00036350418029807346,0.00036350418029807346,0.00036350418029807346,0.00036350418029807346,0.00036350418029807346,0.00036350418029807346,0.00036350418029807346,0.00036350418029807346,0.9927299163940386,0.00036350418029807346,0.00036350418029807346,0.00036350418029807346,0.00036350418029807346,0.00036350418029807346,0.00036350418029807346,0.00036350418029807346,0.00036350418029807346,0.00036350418029807346,0.00036350418029807346,topic_10
Where Are They Now: Covid-19 https://t.co/j6AAcjvhg9,fake,0.004329004329004332,0.004329004329004332,0.004329004329004332,0.004329004329004332,0.004329004329004332,0.004329004329004332,0.004329004329004332,0.004329004329004332,0.004329004329004332,0.004329004329004332,0.4588744588744591,0.004329004329004332,0.004329004329004332,0.004329004329004332,0.004329004329004332,0.004329004329004332,0.004329004329004332,0.004329004329004332,0.004329004329004332,0.004329004329004332,0.4588744588744591,topic_10
The confirmation earlier today of a second death linked to COVID-19 in the last two days means the number of COVID-19 related deaths in New Zealand is now 24.,real,0.0008503401360544216,0.0008503401360544216,0.0008503401360544216,0.0008503401360544216,0.0008503401360544216,0.26870748299319724,0.0008503401360544216,0.0008503401360544216,0.0008503401360544216,0.0008503401360544216,0.7151360544217686,0.0008503401360544216,0.0008503401360544216,0.0008503401360544216,0.0008503401360544216,0.0008503401360544216,0.0008503401360544216,0.0008503401360544216,0.0008503401360544216,0.0008503401360544216,0.0008503401360544216,topic_10
Our total number of confirmed cases to 1184 which is the number we report to the World Health Organization.,real,0.0007215007215007218,0.0007215007215007218,0.0007215007215007218,0.0007215007215007218,0.0007215007215007218,0.0007215007215007218,0.0007215007215007218,0.0007215007215007218,0.0007215007215007218,0.0007215007215007218,0.985569985569986,0.0007215007215007218,0.0007215007215007218,0.0007215007215007218,0.0007215007215007218,0.0007215007215007218,0.0007215007215007218,0.0007215007215007218,0.0007215007215007218,0.0007215007215007218,0.0007215007215007218,topic_10
Six coronavirus cases confirmed in Wichita Kansas.,fake,0.0022675736961451248,0.0022675736961451248,0.0022675736961451248,0.0022675736961451248,0.0022675736961451248,0.0022675736961451248,0.0022675736961451248,0.0022675736961451248,0.0022675736961451248,0.0022675736961451248,0.9546485260770972,0.0022675736961451248,0.0022675736961451248,0.0022675736961451248,0.0022675736961451248,0.0022675736961451248,0.0022675736961451248,0.0022675736961451248,0.0022675736961451248,0.0022675736961451248,0.0022675736961451248,topic_10
Our total number of confirmed cases of COVID-19 is now 1172 which is the number we report to the World Health Organization.,real,0.0007215007215007218,0.0007215007215007218,0.0007215007215007218,0.0007215007215007218,0.0007215007215007218,0.0007215007215007218,0.0007215007215007218,0.0007215007215007218,0.0007215007215007218,0.0007215007215007218,0.985569985569986,0.0007215007215007218,0.0007215007215007218,0.0007215007215007218,0.0007215007215007218,0.0007215007215007218,0.0007215007215007218,0.0007215007215007218,0.0007215007215007218,0.0007215007215007218,0.0007215007215007218,topic_10
big surge in New Zealand. It's terrible. We don't want that.,fake,0.0013227513227513235,0.0013227513227513235,0.0013227513227513235,0.0013227513227513235,0.0013227513227513235,0.0013227513227513235,0.0013227513227513235,0.0013227513227513235,0.0013227513227513235,0.0013227513227513235,0.6957671957671961,0.0013227513227513235,0.0013227513227513235,0.0013227513227513235,0.0013227513227513235,0.0013227513227513235,0.0013227513227513235,0.0013227513227513235,0.0013227513227513235,0.0013227513227513235,0.2791005291005292,topic_10
The Philippines does not have the fastest rising number of COVID-19 cases in the Western Pacific Region as classified by the World Health Organization.,fake,0.0006706908115358817,0.14151576123407106,0.0006706908115358817,0.0006706908115358817,0.0006706908115358817,0.0006706908115358817,0.0006706908115358817,0.0006706908115358817,0.0006706908115358817,0.0006706908115358817,0.634473507712944,0.0006706908115358817,0.21193829644533865,0.0006706908115358817,0.0006706908115358817,0.0006706908115358817,0.0006706908115358817,0.0006706908115358817,0.0006706908115358817,0.0006706908115358817,0.0006706908115358817,topic_10
The latest updates from the Ministry of Health For the 14th day in a row there are no new cases of COVID-19 to report in New Zealand. Our total number of confirmed cases remains at 1154. This is the number we report to the World Health Organisation. https://t.co/WRzffjjbtl,real,0.0003377237419790612,0.0003377237419790612,0.0003377237419790612,0.0003377237419790612,0.0003377237419790612,0.0003377237419790612,0.0003377237419790612,0.0003377237419790612,0.0003377237419790612,0.0003377237419790612,0.9932455251604191,0.0003377237419790612,0.0003377237419790612,0.0003377237419790612,0.0003377237419790612,0.0003377237419790612,0.0003377237419790612,0.0003377237419790612,0.0003377237419790612,0.0003377237419790612,0.0003377237419790612,topic_10
COVID-19 Update There are two new cases of COVID-19 to report in managed isolation in New Zealand today. ​ ​ It has been 92 days since the last case of COVID-19 was acquired locally from an unknown source.,real,0.0005537098560354376,0.0005537098560354376,0.0005537098560354376,0.0005537098560354376,0.0005537098560354376,0.0005537098560354376,0.0005537098560354376,0.0005537098560354376,0.0005537098560354376,0.0005537098560354376,0.9889258028792914,0.0005537098560354376,0.0005537098560354376,0.0005537098560354376,0.0005537098560354376,0.0005537098560354376,0.0005537098560354376,0.0005537098560354376,0.0005537098560354376,0.0005537098560354376,0.0005537098560354376,topic_10
There is a COVID-19 case in Ethiopia.,fake,0.004329004329004332,0.004329004329004332,0.004329004329004332,0.004329004329004332,0.004329004329004332,0.004329004329004332,0.004329004329004332,0.004329004329004332,0.004329004329004332,0.004329004329004332,0.9134199134199138,0.004329004329004332,0.004329004329004332,0.004329004329004332,0.004329004329004332,0.004329004329004332,0.004329004329004332,0.004329004329004332,0.004329004329004332,0.004329004329004332,0.004329004329004332,topic_10
Says Tom Hanks has a volleyball to keep him company while he???s quarantined.,fake,0.0015360983102918582,0.0015360983102918582,0.0015360983102918582,0.0015360983102918582,0.0015360983102918582,0.0015360983102918582,0.0015360983102918582,0.0015360983102918582,0.162826420890937,0.0015360983102918582,0.8079877112135174,0.0015360983102918582,0.0015360983102918582,0.0015360983102918582,0.0015360983102918582,0.0015360983102918582,0.0015360983102918582,0.0015360983102918582,0.0015360983102918582,0.0015360983102918582,0.0015360983102918582,topic_10
The total number of confirmed cases of COVID-19 is now 1212 which is the number we report to the World Health Organization. ​ ​ There is no one in New Zealand receiving hospital-level care for COVID-19.,real,0.0004492362982929024,0.0004492362982929024,0.0004492362982929024,0.0004492362982929024,0.0004492362982929024,0.0004492362982929024,0.0004492362982929024,0.0004492362982929024,0.0004492362982929024,0.0004492362982929024,0.9910152740341424,0.0004492362982929024,0.0004492362982929024,0.0004492362982929024,0.0004492362982929024,0.0004492362982929024,0.0004492362982929024,0.0004492362982929024,0.0004492362982929024,0.0004492362982929024,0.0004492362982929024,topic_10
Our total number of confirmed cases is now 1161.⁣ ⁣ Our combined total of confirmed and probable cases is now 1511.⁣ ⁣ The number of recovered cases remains at 1482.⁣ ⁣ There are no additional deaths to report.⁣,real,0.0004492362982929024,0.0004492362982929024,0.0004492362982929024,0.0004492362982929024,0.0004492362982929024,0.0004492362982929024,0.0004492362982929024,0.0004492362982929024,0.0004492362982929024,0.0004492362982929024,0.9910152740341424,0.0004492362982929024,0.0004492362982929024,0.0004492362982929024,0.0004492362982929024,0.0004492362982929024,0.0004492362982929024,0.0004492362982929024,0.0004492362982929024,0.0004492362982929024,0.0004492362982929024,topic_10
• The 4 cases were passengers on the Greg Mortimer cruise ship. We received confirmation that Uruguay had not previously reported these cases to the WHO. ⁣All 4 cases have recovered. ⁣ • This means New Zealand’s combined total of confirmed and probable cases is now 1503.,real,0.0003779289493575209,0.0003779289493575209,0.0003779289493575209,0.0003779289493575209,0.0003779289493575209,0.0003779289493575209,0.0003779289493575209,0.0003779289493575209,0.0003779289493575209,0.0003779289493575209,0.8337112622826909,0.0003779289493575209,0.0003779289493575209,0.0003779289493575209,0.0003779289493575209,0.0003779289493575209,0.0003779289493575209,0.0003779289493575209,0.04006046863189721,0.0003779289493575209,0.11942554799697658,topic_10
The latest update from the Ministry of Health: ⁣ ⁣ • Today we are reporting two new cases of COVID-19 made up of one confirmed case and one probable case.⁣ ⁣ • Both cases are linked to the St Margaret’s Hospital and Rest Home in Auckland.⁣ https://t.co/Y8erhlPRGR,real,0.00036350418029807346,0.00036350418029807346,0.00036350418029807346,0.00036350418029807346,0.00036350418029807346,0.00036350418029807346,0.00036350418029807346,0.00036350418029807346,0.00036350418029807346,0.00036350418029807346,0.9927299163940386,0.00036350418029807346,0.00036350418029807346,0.00036350418029807346,0.00036350418029807346,0.00036350418029807346,0.00036350418029807346,0.00036350418029807346,0.00036350418029807346,0.00036350418029807346,0.00036350418029807346,topic_10
Latest update from the Ministry of Health: For the 5th consecutive day there are no new cases of COVID-19 in New Zealand. Our total number of confirmed cases remains the same at 1154 and the total number of confirmed and probable cases is 1504. https://t.co/Onzfynu9oA,real,0.00036350418029807346,0.00036350418029807346,0.00036350418029807346,0.00036350418029807346,0.00036350418029807346,0.00036350418029807346,0.00036350418029807346,0.00036350418029807346,0.00036350418029807346,0.00036350418029807346,0.9927299163940386,0.00036350418029807346,0.00036350418029807346,0.00036350418029807346,0.00036350418029807346,0.00036350418029807346,0.00036350418029807346,0.00036350418029807346,0.00036350418029807346,0.00036350418029807346,0.00036350418029807346,topic_10
There are no recovered cases to report today meaning the number of active cases in New Zealand is 24. There is no one in New Zealand receiving hospital-level care for COVID-19.,real,0.0005232862375719521,0.0005232862375719521,0.0005232862375719521,0.0005232862375719521,0.0005232862375719521,0.0005232862375719521,0.0005232862375719521,0.0005232862375719521,0.0005232862375719521,0.0005232862375719521,0.9895342752485612,0.0005232862375719521,0.0005232862375719521,0.0005232862375719521,0.0005232862375719521,0.0005232862375719521,0.0005232862375719521,0.0005232862375719521,0.0005232862375719521,0.0005232862375719521,0.0005232862375719521,topic_10
COVID-19 update There are no new cases of COVID-19 to report in New Zealand today. It has been 98 days since the last case of COVID-19 was acquired locally from an unknown source.,real,0.0006706908115358817,0.0006706908115358817,0.0006706908115358817,0.0006706908115358817,0.0006706908115358817,0.0006706908115358817,0.0006706908115358817,0.0006706908115358817,0.0006706908115358817,0.0006706908115358817,0.986586183769282,0.0006706908115358817,0.0006706908115358817,0.0006706908115358817,0.0006706908115358817,0.0006706908115358817,0.0006706908115358817,0.0006706908115358817,0.0006706908115358817,0.0006706908115358817,0.0006706908115358817,topic_10
⁣There are seven additional recovered cases meaning this total is now 1481. Only one case remains active.⁣ There are no additional deaths to report.⁣⁣ There is no one in New Zealand receiving hospital-level care for COVID-19.⁣,real,0.0004492362982929024,0.0004492362982929024,0.0004492362982929024,0.0004492362982929024,0.0004492362982929024,0.0004492362982929024,0.0004492362982929024,0.0004492362982929024,0.0004492362982929024,0.0004492362982929024,0.9910152740341424,0.0004492362982929024,0.0004492362982929024,0.0004492362982929024,0.0004492362982929024,0.0004492362982929024,0.0004492362982929024,0.0004492362982929024,0.0004492362982929024,0.0004492362982929024,0.0004492362982929024,topic_10
Update from the @minhealthnz ​ There are 2 new cases of COVID-19 to report in managed isolation in New Zealand. It’s been 70 days since the last case of COVID-19 that was acquired locally from an unknown source in the community,real,0.0004960317460317461,0.0004960317460317461,0.0004960317460317461,0.0004960317460317461,0.0004960317460317461,0.0004960317460317461,0.0004960317460317461,0.0004960317460317461,0.0004960317460317461,0.0004960317460317461,0.9900793650793652,0.0004960317460317461,0.0004960317460317461,0.0004960317460317461,0.0004960317460317461,0.0004960317460317461,0.0004960317460317461,0.0004960317460317461,0.0004960317460317461,0.0004960317460317461,0.0004960317460317461,topic_10
Our combined total of confirmed and probable cases remains at 1504. The number of recovered cases is 1482. There are no additional deaths to report. There is no one in New Zealand receiving hospital-level care for COVID-19. Nine significant clusters have now closed.,real,0.0003377237419790612,0.0003377237419790612,0.0003377237419790612,0.0003377237419790612,0.0003377237419790612,0.0003377237419790612,0.0003377237419790612,0.0003377237419790612,0.0003377237419790612,0.0003377237419790612,0.9932455251604191,0.0003377237419790612,0.0003377237419790612,0.0003377237419790612,0.0003377237419790612,0.0003377237419790612,0.0003377237419790612,0.0003377237419790612,0.0003377237419790612,0.0003377237419790612,0.0003377237419790612,topic_10
Latest update from @minhealthnz: It is now 24 days since the last new case of COVID-19 was reported in New Zealand and there are no active cases to report.  Our total number of confirmed cases remains at 1154 which is the number we report to the World Health Organization https://t.co/nwH1lhBppv,real,0.0003377237419790612,0.0003377237419790612,0.0003377237419790612,0.0003377237419790612,0.0003377237419790612,0.0003377237419790612,0.0003377237419790612,0.0003377237419790612,0.0003377237419790612,0.0003377237419790612,0.9932455251604191,0.0003377237419790612,0.0003377237419790612,0.0003377237419790612,0.0003377237419790612,0.0003377237419790612,0.0003377237419790612,0.0003377237419790612,0.0003377237419790612,0.0003377237419790612,0.0003377237419790612,topic_10
Our combined total of confirmed and probable cases remains at 1504. One additional person has recovered taking recoveries to 1456. This represents 97% of all confirmed and probable cases as having recovered from COVID-19. There are no additional deaths to report.,real,0.00039354584809130283,0.00039354584809130283,0.00039354584809130283,0.00039354584809130283,0.00039354584809130283,0.00039354584809130283,0.00039354584809130283,0.00039354584809130283,0.00039354584809130283,0.00039354584809130283,0.9508067689885876,0.00039354584809130283,0.00039354584809130283,0.00039354584809130283,0.00039354584809130283,0.00039354584809130283,0.00039354584809130283,0.041715859897678086,0.00039354584809130283,0.00039354584809130283,0.00039354584809130283,topic_10
• Today we have recorded 97% of all confirmed and probable cases as having recovered from COVID-19 an increase of three on yesterday for a total of 1455. ⁣ ⁣ • There are no additional deaths to report.,real,0.0006265664160401004,0.0006265664160401004,0.0006265664160401004,0.0006265664160401004,0.0006265664160401004,0.0006265664160401004,0.0006265664160401004,0.0006265664160401004,0.0006265664160401004,0.0006265664160401004,0.9874686716791982,0.0006265664160401004,0.0006265664160401004,0.0006265664160401004,0.0006265664160401004,0.0006265664160401004,0.0006265664160401004,0.0006265664160401004,0.0006265664160401004,0.0006265664160401004,0.0006265664160401004,topic_10
COVID-19 Update There are nine new cases of COVID-19 to report in New Zealand today – eight confirmed cases and one probable case. The total number of active cases in New Zealand is 123 of which 19 are imported cases from managed isolation facilities. https://t.co/E7jLtTk8AD,real,0.00035014005602240897,0.00035014005602240897,0.00035014005602240897,0.00035014005602240897,0.00035014005602240897,0.11064425770308124,0.00035014005602240897,0.00035014005602240897,0.00035014005602240897,0.00035014005602240897,0.882703081232493,0.00035014005602240897,0.00035014005602240897,0.00035014005602240897,0.00035014005602240897,0.00035014005602240897,0.00035014005602240897,0.00035014005602240897,0.00035014005602240897,0.00035014005602240897,0.00035014005602240897,topic_10
Latest updates from the Director-General Health and the Police Commissioner ​ ​ • There are no new cases of COVID-19 to report today​ • This means New Zealand’s combined total of confirmed and probable cases is 1499 of which 1149 are confirmed cases of COVID-19 https://t.co/LrsW6Dshxw,real,0.0003779289493575209,0.0003779289493575209,0.0003779289493575209,0.0003779289493575209,0.0003779289493575209,0.0003779289493575209,0.0003779289493575209,0.0003779289493575209,0.0003779289493575209,0.0003779289493575209,0.9924414210128496,0.0003779289493575209,0.0003779289493575209,0.0003779289493575209,0.0003779289493575209,0.0003779289493575209,0.0003779289493575209,0.0003779289493575209,0.0003779289493575209,0.0003779289493575209,0.0003779289493575209,topic_10
There are no new recovered cases to report so there continue to be 23 active cases all in managed isolation facilities. None of those people are receiving hospital-level care. Our number of confirmed cases remains at 1219.,real,0.0004105090311986865,0.0004105090311986865,0.0004105090311986865,0.0004105090311986865,0.0004105090311986865,0.0004105090311986865,0.0004105090311986865,0.0004105090311986865,0.0004105090311986865,0.0004105090311986865,0.9917898193760264,0.0004105090311986865,0.0004105090311986865,0.0004105090311986865,0.0004105090311986865,0.0004105090311986865,0.0004105090311986865,0.0004105090311986865,0.0004105090311986865,0.0004105090311986865,0.0004105090311986865,topic_10
There are five recovered cases to report bringing our total number of active cases to 67. ​Of those 34 are imported cases in MIQ facilities and 33 are community cases.,real,0.0004960317460317461,0.0004960317460317461,0.0004960317460317461,0.0004960317460317461,0.0004960317460317461,0.4692460317460317,0.0004960317460317461,0.0004960317460317461,0.0004960317460317461,0.0004960317460317461,0.5213293650793651,0.0004960317460317461,0.0004960317460317461,0.0004960317460317461,0.0004960317460317461,0.0004960317460317461,0.0004960317460317461,0.0004960317460317461,0.0004960317460317461,0.0004960317460317461,0.0004960317460317461,topic_10
It has been 71 days since the last case of COVID-19 was acquired locally from an unknown source.​ The total number of active cases is 24.​ ​ Today’s new case is a woman in her 20s who arrived in New Zealand on 2 July from London via Doha and Sydney.,real,0.00037792894935752096,0.00037792894935752096,0.00037792894935752096,0.00037792894935752096,0.00037792894935752096,0.19879062736205605,0.00037792894935752096,0.00037792894935752096,0.00037792894935752096,0.00037792894935752096,0.7543461829176117,0.04006046863189721,0.00037792894935752096,0.00037792894935752096,0.00037792894935752096,0.00037792894935752096,0.00037792894935752096,0.00037792894935752096,0.00037792894935752096,0.00037792894935752096,0.00037792894935752096,topic_10
Our total number of confirmed cases is 1271. We will report this to the WHO.,real,0.0013227513227513235,0.0013227513227513235,0.0013227513227513235,0.0013227513227513235,0.0013227513227513235,0.0013227513227513235,0.0013227513227513235,0.0013227513227513235,0.0013227513227513235,0.0013227513227513235,0.973544973544974,0.0013227513227513235,0.0013227513227513235,0.0013227513227513235,0.0013227513227513235,0.0013227513227513235,0.0013227513227513235,0.0013227513227513235,0.0013227513227513235,0.0013227513227513235,0.0013227513227513235,topic_10
NEWS! Government’s Covid-19 alert level reduced from ‘Asleep’ to ‘Comatose’ https://t.co/0nFUq0jjdS https://t.co/L7rljjPtx5,fake,0.0010351966873706005,0.0010351966873706005,0.0010351966873706005,0.0010351966873706005,0.0010351966873706005,0.0010351966873706005,0.0010351966873706005,0.0010351966873706005,0.0010351966873706005,0.0010351966873706005,0.5445134575569357,0.0010351966873706005,0.0010351966873706005,0.0010351966873706005,0.0010351966873706005,0.3271221532091097,0.0010351966873706005,0.0010351966873706005,0.10973084886128362,0.0010351966873706005,0.0010351966873706005,topic_10
85% of PCPs report #COVID significantly changed their work; 77% of specialists report the same. https://t.co/xnOPr6vYle,real,0.0013227513227513233,0.0013227513227513233,0.2791005291005292,0.0013227513227513233,0.0013227513227513233,0.0013227513227513233,0.0013227513227513233,0.0013227513227513233,0.0013227513227513233,0.0013227513227513233,0.5568783068783071,0.0013227513227513233,0.0013227513227513233,0.0013227513227513233,0.14021164021164026,0.0013227513227513233,0.0013227513227513233,0.0013227513227513233,0.0013227513227513233,0.0013227513227513233,0.0013227513227513233,topic_10
For the rest of New Zealand: The rest of New Zealand will go into Alert Level 2 on 12 noon on Wednesday 12 August. You will still be able to go to work and school with physical distancing. Wear masks if you can in public.,real,0.0004492362982929024,0.0004492362982929024,0.0004492362982929024,0.0004492362982929024,0.0004492362982929024,0.09478885893980238,0.0004492362982929024,0.0004492362982929024,0.0004492362982929024,0.4249775381850856,0.4721473495058403,0.0004492362982929024,0.0004492362982929024,0.0004492362982929024,0.0004492362982929024,0.0004492362982929024,0.0004492362982929024,0.0004492362982929024,0.0004492362982929024,0.0004492362982929024,0.0004492362982929024,topic_10
The latest updates from the Director-General of Health:⁣ ⁣ • There are no new cases of COVID-19 to report in New Zealand today.⁣ ⁣ • This means New Zealand’s combined total of confirmed and probable cases remains at 1503 of which 1153 are confirmed cases of COVID-19.⁣ https://t.co/OuFRChjB10,real,0.0003779289493575209,0.0003779289493575209,0.0003779289493575209,0.0003779289493575209,0.0003779289493575209,0.0003779289493575209,0.0003779289493575209,0.0003779289493575209,0.0003779289493575209,0.0003779289493575209,0.9924414210128496,0.0003779289493575209,0.0003779289493575209,0.0003779289493575209,0.0003779289493575209,0.0003779289493575209,0.0003779289493575209,0.0003779289493575209,0.0003779289493575209,0.0003779289493575209,0.0003779289493575209,topic_10
Our total number of confirmed cases remains at 1205 which is the number we report to the World Health Organization.,real,0.0006265664160401004,0.0006265664160401004,0.0006265664160401004,0.0006265664160401004,0.0006265664160401004,0.0006265664160401004,0.0006265664160401004,0.0006265664160401004,0.0006265664160401004,0.0006265664160401004,0.9874686716791982,0.0006265664160401004,0.0006265664160401004,0.0006265664160401004,0.0006265664160401004,0.0006265664160401004,0.0006265664160401004,0.0006265664160401004,0.0006265664160401004,0.0006265664160401004,0.0006265664160401004,topic_10
