tweet,label,topic_0,topic_1,topic_2,topic_3,topic_4,topic_5,topic_6,topic_7,topic_8,topic_9,topic_10,topic_11,topic_12,topic_13,topic_14,topic_15,topic_16,topic_17,topic_18,topic_19,topic_20,Max
• We now have 1421 people reported as having recovered from COVID-19 an increase of 10 on yesterday. This is 95% of all confirmed and probable cases.⁣ ⁣ • There are now just 56 'active' cases across the country.⁣,real,0.0006706908115358817,0.0006706908115358817,0.0006706908115358817,0.0006706908115358817,0.0006706908115358817,0.0006706908115358817,0.0006706908115358817,0.0006706908115358817,0.0006706908115358817,0.0006706908115358817,0.986586183769282,0.0006706908115358817,0.0006706908115358817,0.0006706908115358817,0.0006706908115358817,0.0006706908115358817,0.0006706908115358817,0.0006706908115358817,0.0006706908115358817,0.0006706908115358817,0.0006706908115358817,topic_10
Latest update from the @minhealthnz Today there are 4 new cases of COVID-19 at the border. There continue to be no cases in the community. All four cases involve people who have recently returned from overseas and were in managed isolation facilities.,real,0.0003935458480913028,0.0003935458480913028,0.0003935458480913028,0.0003935458480913028,0.0003935458480913028,0.0003935458480913028,0.0003935458480913028,0.0003935458480913028,0.0003935458480913028,0.0003935458480913028,0.9921290830381744,0.0003935458480913028,0.0003935458480913028,0.0003935458480913028,0.0003935458480913028,0.0003935458480913028,0.0003935458480913028,0.0003935458480913028,0.0003935458480913028,0.0003935458480913028,0.0003935458480913028,topic_10
There is no one in New Zealand receiving hospital-level care for COVID-19. Yesterday our laboratories completed 1527 tests bringing the total completed to date to 312648. Full update: https://t.co/2Cs0bCGNi8,real,0.4249775381850856,0.00044923629829290236,0.00044923629829290236,0.00044923629829290236,0.00044923629829290236,0.00044923629829290236,0.00044923629829290236,0.00044923629829290236,0.00044923629829290236,0.00044923629829290236,0.5664869721473498,0.00044923629829290236,0.00044923629829290236,0.00044923629829290236,0.00044923629829290236,0.00044923629829290236,0.00044923629829290236,0.00044923629829290236,0.00044923629829290236,0.00044923629829290236,0.00044923629829290236,topic_10
The number of recovered cases is unchanged at 1481. Only one case remains active. There are no additional deaths to report. There is no one in New Zealand receiving hospital-level care for COVID-19.,real,0.0004492362982929024,0.0004492362982929024,0.0004492362982929024,0.0004492362982929024,0.0004492362982929024,0.0004492362982929024,0.0004492362982929024,0.0004492362982929024,0.0004492362982929024,0.0004492362982929024,0.9910152740341424,0.0004492362982929024,0.0004492362982929024,0.0004492362982929024,0.0004492362982929024,0.0004492362982929024,0.0004492362982929024,0.0004492362982929024,0.0004492362982929024,0.0004492362982929024,0.0004492362982929024,topic_10
COVID-19 update​ ​ There are two new cases of COVID-19 to report in managed isolation facilities in New Zealand today.​ ​ It has been 94 days since the last case of COVID-19 was acquired locally from an unknown source.​ The total number of active cases in NZ is 27.,real,0.0003779289493575209,0.0003779289493575209,0.0003779289493575209,0.0003779289493575209,0.0003779289493575209,0.0003779289493575209,0.0003779289493575209,0.0003779289493575209,0.0003779289493575209,0.0003779289493575209,0.9924414210128496,0.0003779289493575209,0.0003779289493575209,0.0003779289493575209,0.0003779289493575209,0.0003779289493575209,0.0003779289493575209,0.0003779289493575209,0.0003779289493575209,0.0003779289493575209,0.0003779289493575209,topic_10
Our combined total of confirmed and probable cases remains at 1504. The number of recovered cases is unchanged at 1481. Only one case remains active. There are no additional deaths to report. There is no one in New Zealand receiving hospital-level care for COVID-19.,real,0.0003153579312519712,0.0003153579312519712,0.0003153579312519712,0.0003153579312519712,0.0003153579312519712,0.0003153579312519712,0.0003153579312519712,0.0003153579312519712,0.0003153579312519712,0.0003153579312519712,0.9936928413749612,0.0003153579312519712,0.0003153579312519712,0.0003153579312519712,0.0003153579312519712,0.0003153579312519712,0.0003153579312519712,0.0003153579312519712,0.0003153579312519712,0.0003153579312519712,0.0003153579312519712,topic_10
COVID-19 Update: There are no new cases of COVID-19 to report in New Zealand today. It has been 101 days since the last case of COVID-19 was acquired locally from an unknown source.,real,0.0006706908115358817,0.0006706908115358817,0.0006706908115358817,0.0006706908115358817,0.0006706908115358817,0.0006706908115358817,0.0006706908115358817,0.0006706908115358817,0.0006706908115358817,0.0006706908115358817,0.986586183769282,0.0006706908115358817,0.0006706908115358817,0.0006706908115358817,0.0006706908115358817,0.0006706908115358817,0.0006706908115358817,0.0006706908115358817,0.0006706908115358817,0.0006706908115358817,0.0006706908115358817,topic_10
• We have 1442 people reported as having recovered from COVID-19. This is 96% of all confirmed and probable cases.⁣ ⁣ • There are two people receiving hospital-level care for COVID-19. Neither of these patients are in ICU.⁣ ⁣ • We still have 16 significant clusters.⁣,real,0.0004492362982929024,0.0004492362982929024,0.0004492362982929024,0.0004492362982929024,0.0004492362982929024,0.3306379155435761,0.0004492362982929024,0.0004492362982929024,0.0004492362982929024,0.0004492362982929024,0.6608265947888593,0.0004492362982929024,0.0004492362982929024,0.0004492362982929024,0.0004492362982929024,0.0004492362982929024,0.0004492362982929024,0.0004492362982929024,0.0004492362982929024,0.0004492362982929024,0.0004492362982929024,topic_10
Latest updates from @minhealthnz There are 2 new confirmed cases of COVID-19 in New Zealand. Two women from the same family one in her 30s and the other in her 40s who recently arrived from the UK via Australia have today been confirmed with COVID-19. https://t.co/YDYueoFIR4,real,0.0004714757190004712,0.0004714757190004712,0.0004714757190004712,0.0004714757190004712,0.0004714757190004712,0.3470061291843468,0.0004714757190004712,0.0004714757190004712,0.0004714757190004712,0.0004714757190004712,0.6440358321546437,0.0004714757190004712,0.0004714757190004712,0.0004714757190004712,0.0004714757190004712,0.0004714757190004712,0.0004714757190004712,0.0004714757190004712,0.0004714757190004712,0.0004714757190004712,0.0004714757190004712,topic_10
Latest update from the @minhealthnz: ⁣ There are 3 new cases of COVID-19 to report in managed isolation facilities in New Zealand today. 1 in Rotorua and 2 in Christchurch. There is no community transmission in NZ.⁣ ⁣,real,0.0004714757190004713,0.0004714757190004713,0.0004714757190004713,0.0004714757190004713,0.0004714757190004713,0.2479962281942479,0.0004714757190004713,0.0004714757190004713,0.0004714757190004713,0.0004714757190004713,0.7430457331447428,0.0004714757190004713,0.0004714757190004713,0.0004714757190004713,0.0004714757190004713,0.0004714757190004713,0.0004714757190004713,0.0004714757190004713,0.0004714757190004713,0.0004714757190004713,0.0004714757190004713,topic_10
The total number of confirmed cases of COVID-19 remains at 1206 which is the number we report to @WHO. There are no new recovered cases today which means the total number of active cases in New Zealand's managed isolation and quarantine facilities remains at 21.,real,0.0003377237419790612,0.0003377237419790612,0.0003377237419790612,0.0003377237419790612,0.0003377237419790612,0.0003377237419790612,0.0003377237419790612,0.0003377237419790612,0.0003377237419790612,0.0003377237419790612,0.9932455251604191,0.0003377237419790612,0.0003377237419790612,0.0003377237419790612,0.0003377237419790612,0.0003377237419790612,0.0003377237419790612,0.0003377237419790612,0.0003377237419790612,0.0003377237419790612,0.0003377237419790612,topic_10
Our total number of confirmed cases of COVID-19 is now 1447 which is the number we report to the World Health Organization.,real,0.0007215007215007218,0.0007215007215007218,0.0007215007215007218,0.0007215007215007218,0.0007215007215007218,0.0007215007215007218,0.0007215007215007218,0.0007215007215007218,0.0007215007215007218,0.0007215007215007218,0.985569985569986,0.0007215007215007218,0.0007215007215007218,0.0007215007215007218,0.0007215007215007218,0.0007215007215007218,0.0007215007215007218,0.0007215007215007218,0.0007215007215007218,0.0007215007215007218,0.0007215007215007218,topic_10
@ThirdEyeBlind9 Hi We know this is tough. We find out on Monday if New Zealand will move alert levels. At Alert Level two domestic travel is allowed. You can't drive from Auckland to Wellington under alert level three. The rules are outlined here https://t.co/B3YuZO5Ma0,real,0.0003935458480913028,0.0003935458480913028,0.0003935458480913028,0.0003935458480913028,0.0003935458480913028,0.0003935458480913028,0.0003935458480913028,0.0003935458480913028,0.0003935458480913028,0.0003935458480913028,0.6202282565918932,0.0003935458480913028,0.0003935458480913028,0.0003935458480913028,0.0003935458480913028,0.3722943722943725,0.0003935458480913028,0.0003935458480913028,0.0003935458480913028,0.0003935458480913028,0.0003935458480913028,topic_10
Our total number of confirmed cases of COVID-19 is now 1444 which is the number we report to the World Health Organization.​ ​ Yesterday our laboratories processed 8838 tests bringing the total number of tests completed to date to 857258.,real,0.3679971988795519,0.00035014005602240897,0.00035014005602240897,0.00035014005602240897,0.00035014005602240897,0.00035014005602240897,0.00035014005602240897,0.00035014005602240897,0.00035014005602240897,0.00035014005602240897,0.6253501400560224,0.00035014005602240897,0.00035014005602240897,0.00035014005602240897,0.00035014005602240897,0.00035014005602240897,0.00035014005602240897,0.00035014005602240897,0.00035014005602240897,0.00035014005602240897,0.00035014005602240897,topic_10
Our total number of confirmed cases of COVID-19 is now 1464 which is the number we report to the World Health Organization. ​ ​ Yesterday our laboratories processed 5417 tests bringing the total number of tests completed to date to 910853.,real,0.4782913165266106,0.00035014005602240897,0.00035014005602240897,0.00035014005602240897,0.00035014005602240897,0.00035014005602240897,0.00035014005602240897,0.00035014005602240897,0.00035014005602240897,0.00035014005602240897,0.5150560224089636,0.00035014005602240897,0.00035014005602240897,0.00035014005602240897,0.00035014005602240897,0.00035014005602240897,0.00035014005602240897,0.00035014005602240897,0.00035014005602240897,0.00035014005602240897,0.00035014005602240897,topic_10
Our combined total of confirmed and probable cases remains at 1504.⁣ ⁣ The number of recovered cases is now 1482.⁣ There are no additional deaths to report.⁣ ⁣ There is no one in New Zealand receiving hospital-level care for COVID-19.⁣ ⁣,real,0.0003935458480913028,0.0003935458480913028,0.0003935458480913028,0.0003935458480913028,0.0003935458480913028,0.0003935458480913028,0.0003935458480913028,0.0003935458480913028,0.0003935458480913028,0.0003935458480913028,0.9921290830381744,0.0003935458480913028,0.0003935458480913028,0.0003935458480913028,0.0003935458480913028,0.0003935458480913028,0.0003935458480913028,0.0003935458480913028,0.0003935458480913028,0.0003935458480913028,0.0003935458480913028,topic_10
The latest updates from the Director-General of Health:⁣ ⁣ • There are no new cases of COVID-19 to report in New Zealand today.⁣ ⁣ • This means New Zealand’s combined total of confirmed and probable cases remains at 1503 of which 1153 are confirmed cases of COVID-19.⁣ https://t.co/SzDDkyE7rB,real,0.0003779289493575209,0.0003779289493575209,0.0003779289493575209,0.0003779289493575209,0.0003779289493575209,0.0003779289493575209,0.0003779289493575209,0.0003779289493575209,0.0003779289493575209,0.0003779289493575209,0.9924414210128496,0.0003779289493575209,0.0003779289493575209,0.0003779289493575209,0.0003779289493575209,0.0003779289493575209,0.0003779289493575209,0.0003779289493575209,0.0003779289493575209,0.0003779289493575209,0.0003779289493575209,topic_10
There were a further 3395 cases of #coronavirus in the UK as of 9am on Thursday. Follow latest #COVID19 updates 👇 https://t.co/NyZLPJyfxM,real,0.0013227513227513233,0.0013227513227513233,0.0013227513227513233,0.0013227513227513233,0.0013227513227513233,0.0013227513227513233,0.0013227513227513233,0.0013227513227513233,0.0013227513227513233,0.0013227513227513233,0.5568783068783071,0.4179894179894181,0.0013227513227513233,0.0013227513227513233,0.0013227513227513233,0.0013227513227513233,0.0013227513227513233,0.0013227513227513233,0.0013227513227513233,0.0013227513227513233,0.0013227513227513233,topic_10
COVID-19 Update ​ ​ Today we have 1 new case of COVID-19 to report in managed isolation facilities in New Zealand. ​ ​ It has now been 102 days since the last case of COVID-19 was acquired locally from an unknown source. We have 22 active cases - all are in quarantine.,real,0.0004290004290004292,0.0004290004290004292,0.0004290004290004292,0.0004290004290004292,0.0004290004290004292,0.0004290004290004292,0.0004290004290004292,0.0004290004290004292,0.0004290004290004292,0.0004290004290004292,0.9914199914199916,0.0004290004290004292,0.0004290004290004292,0.0004290004290004292,0.0004290004290004292,0.0004290004290004292,0.0004290004290004292,0.0004290004290004292,0.0004290004290004292,0.0004290004290004292,0.0004290004290004292,topic_10
COVID-19 Update There are no new cases of COVID-19 to report in New Zealand today.​⁣ It has been 100 days since the last case of COVID-19 was acquired locally from an unknown source. We have 23 active cases of COVID-19 in managed isolation facilities.​⁣,real,0.0004492362982929024,0.0004492362982929024,0.0004492362982929024,0.0004492362982929024,0.0004492362982929024,0.0004492362982929024,0.0004492362982929024,0.0004492362982929024,0.0004492362982929024,0.0004492362982929024,0.9910152740341424,0.0004492362982929024,0.0004492362982929024,0.0004492362982929024,0.0004492362982929024,0.0004492362982929024,0.0004492362982929024,0.0004492362982929024,0.0004492362982929024,0.0004492362982929024,0.0004492362982929024,topic_10
Two people are now considered to have recovered from COVID-19 which means there are 22 active cases of COVID-19 in New Zealand all in managed isolation or quarantine.,real,0.0007806401249024201,0.0007806401249024201,0.0007806401249024201,0.0007806401249024201,0.0007806401249024201,0.0007806401249024201,0.0007806401249024201,0.0007806401249024201,0.0007806401249024201,0.0007806401249024201,0.9843871975019516,0.0007806401249024201,0.0007806401249024201,0.0007806401249024201,0.0007806401249024201,0.0007806401249024201,0.0007806401249024201,0.0007806401249024201,0.0007806401249024201,0.0007806401249024201,0.0007806401249024201,topic_10
Update from the @minhealthnz ​ There are no new cases of COVID-19 to report in New Zealand today. ​ ​ The number of active cases in New Zealand remains at 18 all of which are in managed isolation or quarantine facilities. There are no cases of COVID-19 in the community.,real,0.00041050903119868663,0.00041050903119868663,0.00041050903119868663,0.00041050903119868663,0.04351395730706077,0.00041050903119868663,0.00041050903119868663,0.00041050903119868663,0.00041050903119868663,0.00041050903119868663,0.9486863711001644,0.00041050903119868663,0.00041050903119868663,0.00041050903119868663,0.00041050903119868663,0.00041050903119868663,0.00041050903119868663,0.00041050903119868663,0.00041050903119868663,0.00041050903119868663,0.00041050903119868663,topic_10
The latest update from the Prime Minister and Director-General of Health:⁣ ⁣ • Today we are reporting no new cases of COVID-19.⁣ ⁣ • Today’s combined total of confirmed and probable COVID-19 cases remains at 1497.⁣ https://t.co/iJxzA5EJ4k,real,0.0004290004290004292,0.0004290004290004292,0.0004290004290004292,0.0004290004290004292,0.0004290004290004292,0.0004290004290004292,0.0004290004290004292,0.0004290004290004292,0.0004290004290004292,0.0004290004290004292,0.9914199914199916,0.0004290004290004292,0.0004290004290004292,0.0004290004290004292,0.0004290004290004292,0.0004290004290004292,0.0004290004290004292,0.0004290004290004292,0.0004290004290004292,0.0004290004290004292,0.0004290004290004292,topic_10
Guatemalan Ministry of Health is hiding a COVID-19 case in a hospital in the city of Amatitlán.,fake,0.0010351966873706005,0.0010351966873706005,0.0010351966873706005,0.0010351966873706005,0.0010351966873706005,0.0010351966873706005,0.0010351966873706005,0.0010351966873706005,0.0010351966873706005,0.0010351966873706005,0.7619047619047618,0.0010351966873706005,0.0010351966873706005,0.10973084886128362,0.10973084886128362,0.0010351966873706005,0.0010351966873706005,0.0010351966873706005,0.0010351966873706005,0.0010351966873706005,0.0010351966873706005,topic_10
Our combined total of confirmed and probable cases remains at 1504.⁣ ⁣ The number of recovered cases is unchanged at 1481. Only one case remains active.⁣ ⁣ There are no additional deaths to report.⁣,real,0.0004290004290004292,0.0004290004290004292,0.0004290004290004292,0.0004290004290004292,0.0004290004290004292,0.0004290004290004292,0.0004290004290004292,0.0004290004290004292,0.0004290004290004292,0.0004290004290004292,0.9914199914199916,0.0004290004290004292,0.0004290004290004292,0.0004290004290004292,0.0004290004290004292,0.0004290004290004292,0.0004290004290004292,0.0004290004290004292,0.0004290004290004292,0.0004290004290004292,0.0004290004290004292,topic_10
Update from @minhealthnz Today there is 1 new case of COVID-19 to report in Managed Isolation. It has now been 88 days since the last case of COVID-19 was acquired locally from an unknown source.,real,0.0005537098560354376,0.0005537098560354376,0.0005537098560354376,0.0005537098560354376,0.0005537098560354376,0.0005537098560354376,0.0005537098560354376,0.0005537098560354376,0.0005537098560354376,0.0005537098560354376,0.9889258028792914,0.0005537098560354376,0.0005537098560354376,0.0005537098560354376,0.0005537098560354376,0.0005537098560354376,0.0005537098560354376,0.0005537098560354376,0.0005537098560354376,0.0005537098560354376,0.0005537098560354376,topic_10
The total number of confirmed cases of COVID-19 remains at 1206 which is the number we report to @WHO . There are no new recovered cases today which means the total number of active cases in New Zealand's managed isolation and quarantine facilities remains at 21.,real,0.0003377237419790612,0.0003377237419790612,0.0003377237419790612,0.0003377237419790612,0.0003377237419790612,0.0003377237419790612,0.0003377237419790612,0.0003377237419790612,0.0003377237419790612,0.0003377237419790612,0.9932455251604191,0.0003377237419790612,0.0003377237419790612,0.0003377237419790612,0.0003377237419790612,0.0003377237419790612,0.0003377237419790612,0.0003377237419790612,0.0003377237419790612,0.0003377237419790612,0.0003377237419790612,topic_10
This means New Zealand’s combined total of confirmed and probable cases is 1499 of which 1149 are confirmed cases of COVID-19.⁣⁣⁣⁣ ⁣⁣⁣⁣ We now have 1433 people reported as having recovered from COVID-19 an increase of five on yesterday. This is 96% of all cases. ⁣⁣,real,0.0004960317460317461,0.0004960317460317461,0.0004960317460317461,0.0004960317460317461,0.0004960317460317461,0.0004960317460317461,0.0004960317460317461,0.0004960317460317461,0.0004960317460317461,0.0004960317460317461,0.9379960317460316,0.0004960317460317461,0.0004960317460317461,0.0004960317460317461,0.0004960317460317461,0.0004960317460317461,0.0004960317460317461,0.0004960317460317461,0.0004960317460317461,0.05257936507936508,0.0004960317460317461,topic_10
This case brings our total number of confirmed cases to 1195 which is the number we report to the World Health Organization. One previously reported case is now considered to have recovered from COVID-19 so the total number of active cases in New Zealand remains at 25.,real,0.0003153579312519712,0.0003153579312519712,0.0003153579312519712,0.0003153579312519712,0.0003153579312519712,0.0003153579312519712,0.0003153579312519712,0.0003153579312519712,0.0003153579312519712,0.0003153579312519712,0.9936928413749612,0.0003153579312519712,0.0003153579312519712,0.0003153579312519712,0.0003153579312519712,0.0003153579312519712,0.0003153579312519712,0.0003153579312519712,0.0003153579312519712,0.0003153579312519712,0.0003153579312519712,topic_10
Update from the @minhealthnz Today there are 2 new cases of COVID-19 to report in managed isolation in NZ. ​ There continue to be no cases of COVID-19 in the community. It has been 67 days since the last case of COVID-19 that was acquired locally from an unknown source.,real,0.0004492362982929024,0.0004492362982929024,0.0004492362982929024,0.0004492362982929024,0.0004492362982929024,0.0004492362982929024,0.0004492362982929024,0.0004492362982929024,0.0004492362982929024,0.0004492362982929024,0.9910152740341424,0.0004492362982929024,0.0004492362982929024,0.0004492362982929024,0.0004492362982929024,0.0004492362982929024,0.0004492362982929024,0.0004492362982929024,0.0004492362982929024,0.0004492362982929024,0.0004492362982929024,topic_10
1 previously reported case is now considered recovered the total number of active cases in New Zealand 129 - of which 19 are imported cases in quarantine. This brings our total number confirmed cases of 1339. We will report this to the World Health Organization.,real,0.0003052503052503053,0.0003052503052503053,0.0003052503052503053,0.0003052503052503053,0.0003052503052503053,0.16056166056166055,0.0003052503052503053,0.0003052503052503053,0.0003052503052503053,0.0003052503052503053,0.8336385836385837,0.0003052503052503053,0.0003052503052503053,0.0003052503052503053,0.0003052503052503053,0.0003052503052503053,0.0003052503052503053,0.0003052503052503053,0.0003052503052503053,0.0003052503052503053,0.0003052503052503053,topic_10
Update from @minhealthnz Today there are no new cases of COVID-19 to report. It has now been 87 days since the last case of COVID-19 was acquired locally from an unknown source.,real,0.0006706908115358817,0.0006706908115358817,0.0006706908115358817,0.0006706908115358817,0.0006706908115358817,0.0006706908115358817,0.0006706908115358817,0.0006706908115358817,0.0006706908115358817,0.0006706908115358817,0.986586183769282,0.0006706908115358817,0.0006706908115358817,0.0006706908115358817,0.0006706908115358817,0.0006706908115358817,0.0006706908115358817,0.0006706908115358817,0.0006706908115358817,0.0006706908115358817,0.0006706908115358817,topic_10
An Update on Alert Levels Auckland will remain at Alert Level 3 and the rest of New Zealand will remain at Level 2 until 11:59 pm on Wednesday the 26th of August. This brings us to a full 2 weeks in total. https://t.co/XV52fcvNg9,real,0.0004492362982929024,0.0004492362982929024,0.0004492362982929024,0.0004492362982929024,0.0004492362982929024,0.0004492362982929024,0.0004492362982929024,0.0004492362982929024,0.0004492362982929024,0.0004492362982929024,0.8023360287511234,0.0004492362982929024,0.0004492362982929024,0.0004492362982929024,0.0004492362982929024,0.04761904761904764,0.0004492362982929024,0.1419586702605571,0.0004492362982929024,0.0004492362982929024,0.0004492362982929024,topic_10
Latest updates from Ministry of Health: There are no new cases of COVID-19 to report in New Zealand. This is the 11th consecutive day of no new cases. Our total number of confirmed cases remains at 1154 which is the number we report to the World Health Organization. https://t.co/4rDqXHXHwG,real,0.00032615786040443573,0.00032615786040443573,0.00032615786040443573,0.00032615786040443573,0.00032615786040443573,0.00032615786040443573,0.00032615786040443573,0.00032615786040443573,0.00032615786040443573,0.00032615786040443573,0.9934768427919112,0.00032615786040443573,0.00032615786040443573,0.00032615786040443573,0.00032615786040443573,0.00032615786040443573,0.00032615786040443573,0.00032615786040443573,0.00032615786040443573,0.00032615786040443573,0.00032615786040443573,topic_10
Update from the @minhealthnz ​ There are no new cases of COVID-19 to report today.​ ​The number of active cases in NZ remains at 22. All active cases have recently returned from overseas and were in managed isolation facilities. There are no cases of community transmission.,real,0.00032615786040443573,0.00032615786040443573,0.00032615786040443573,0.00032615786040443573,0.00032615786040443573,0.00032615786040443573,0.00032615786040443573,0.00032615786040443573,0.00032615786040443573,0.00032615786040443573,0.9934768427919112,0.00032615786040443573,0.00032615786040443573,0.00032615786040443573,0.00032615786040443573,0.00032615786040443573,0.00032615786040443573,0.00032615786040443573,0.00032615786040443573,0.00032615786040443573,0.00032615786040443573,topic_10
• The total combined number of confirmed and probable cases in New Zealand is 1490. • 1347 people have recovered – 90% of our confirmed and probable cases are now recovered. • 7812 tests were processed yesterday. This brings the total number of tests to 175835.,real,0.22093837535014005,0.00035014005602240897,0.00035014005602240897,0.00035014005602240897,0.00035014005602240897,0.00035014005602240897,0.00035014005602240897,0.00035014005602240897,0.00035014005602240897,0.00035014005602240897,0.7724089635854342,0.00035014005602240897,0.00035014005602240897,0.00035014005602240897,0.00035014005602240897,0.00035014005602240897,0.00035014005602240897,0.00035014005602240897,0.00035014005602240897,0.00035014005602240897,0.00035014005602240897,topic_10
